{
  "id": "claim-nuragic-santa-vittoria-seed-j",
  "entity": "claim",
  "kind": "fact",
  "statement": {
    "zh": "圣维多利亚是重要的努拉吉圣所。",
    "en": "Santa Vittoria is a major Nuragic sanctuary.",
    "native": null
  },
  "civilization_ids": [
    "civ-nuragic-sardinia"
  ],
  "site_ids": [
    "site-nuragic-santa-vittoria-deepen-f"
  ],
  "period_ids": [],
  "object_ids": [],
  "sources": [
    "src-nuragic-santa-vittoria-seed-j",
    "src-nuragic-water-seed-j"
  ],
  "disclaimer": null,
  "editorial": {
    "derived_from": [
      "tools/hot_densify/densify_seed_batch_j.py",
      "docs/coverage-map.md",
      "docs/decisions.md#d-2026-10-13-04"
    ],
    "derived_on": "2026-10-13",
    "notes": "Seed densify Batch J toward ~48 sources (D-2026-10-13-04). No invented pages/coords/finds/media. Status stays library-seed-rich."
  }
}
