{
  "id": "claim-china-huanbei-as-hedanjia-capital",
  "entity": "claim",
  "kind": "hypothesis",
  "statement": {
    "zh": "洹北商城对应河亶甲迁相或其他中商王都的指认，属假说。",
    "en": "Identifying Huanbei with He Dan Jia’s Xiang capital (or another Middle Shang seat) is hypothesis."
  },
  "civilization_ids": [
    "civ-china-bronze"
  ],
  "site_ids": [
    "site-huanbei"
  ],
  "period_ids": [
    "period-china-xiaoshuangqiao-huanbei"
  ],
  "object_ids": [],
  "sources": [
    "src-china-huanbei-palace-1-2003",
    "src-china-campbell-bronze-age-2014",
    "src-china-cass-xia-shang-2003"
  ],
  "editorial": {
    "derived_from": [
      "data/civilizations/civ-china-bronze.md",
      "data/civilizations/civ-sanxingdui.md",
      "sources/src-*"
    ],
    "derived_on": "2026-10-11",
    "notes": "Density pass D-2026-10-11-25; bibliographic details verified via WebSearch/catalogs; no invented page numbers/coordinates/forged images."
  },
  "disclaimer": "This record is a HYPOTHESIS / contested scholarly reading, not an established archaeological conclusion. Do not treat as fact."
}
