{
  "id": "claim-tiwanaku-kolata",
  "entity": "claim",
  "kind": "fact",
  "statement": {
    "zh": "蒂瓦纳科文明英语肖像式综合见 Kolata 1993（综合导向）。",
    "en": "Tiwanaku civilization is framed in Kolata 1993 portrait-style English synthesis (orientation)."
  },
  "civilization_ids": [
    "civ-tiwanaku"
  ],
  "site_ids": [
    "site-tiwanaku-capital"
  ],
  "period_ids": [],
  "object_ids": [],
  "sources": [
    "src-tiwanaku-kolata-1993"
  ],
  "disclaimer": null,
  "editorial": {
    "derived_from": [
      "tools/wave2_shells/densify_wave2.py",
      "docs/coverage-map.md",
      "docs/decisions.md#d-2026-10-12-16"
    ],
    "derived_on": "2026-10-12",
    "notes": "Wave-2 densify to library-seed-rich (D-2026-10-12-16). No invented pages/coords/finds/media art. Honest thin > fake dense. Audit D-2026-10-12-18: biblio-meta fact rewritten toward report-level orientation (no invented archaeology)."
  }
}
