{
  "id": "claim-aztec-tenayuca-r3b",
  "entity": "claim",
  "kind": "fact",
  "statement": {
    "zh": "特纳尤卡双金字塔展示后经典盆地神庙建筑的连续传统。",
    "en": "Tenayuca’s double pyramid shows continuity of Postclassic Basin temple architecture.",
    "native": null
  },
  "civilization_ids": [
    "civ-aztec"
  ],
  "site_ids": [
    "site-aztec-tenayuca-r3b"
  ],
  "period_ids": [],
  "object_ids": [],
  "sources": [
    "src-aztec-tenayuca-r3b",
    "src-aztec-smith-r3b"
  ],
  "disclaimer": null,
  "editorial": {
    "derived_from": [
      "tools/hot_densify/densify_hot_round3_b.py",
      "docs/coverage-map.md",
      "docs/decisions.md#d-2026-10-12-29"
    ],
    "derived_on": "2026-10-12",
    "notes": "Hot-pack densify Round-2 toward denser archive (D-2026-10-12-29). No invented pages/coords/finds/media art. Status stays library-seed-rich (still below Egypt-level fact-library)."
  }
}
