{
  "id": "claim-pueblo-lekson-seed-n",
  "entity": "claim",
  "kind": "fact",
  "statement": {
    "zh": "Lekson 综合是查科研究的关键入口。",
    "en": "Lekson’s synthesis is a key entry to Chaco studies.",
    "native": null
  },
  "civilization_ids": [
    "civ-ancestral-pueblo"
  ],
  "site_ids": [],
  "period_ids": [],
  "object_ids": [],
  "sources": [
    "src-pueblo-lekson-seed-n",
    "src-pueblo-bonito-seed-n"
  ],
  "disclaimer": null,
  "editorial": {
    "derived_from": [
      "tools/hot_densify/densify_seed_batch_n.py",
      "docs/coverage-map.md",
      "docs/decisions.md#d-2026-10-13-08"
    ],
    "derived_on": "2026-10-13",
    "notes": "Seed densify Batch N toward ~71 sources (D-2026-10-13-08). No invented pages/coords/finds/media. Status stays library-seed-rich."
  }
}
