{
  "id": "claim-meso-genouillac-telloh-i",
  "entity": "claim",
  "kind": "fact",
  "statement": {
    "zh": "特罗（吉尔苏）前萨尔贡层位与出土见 de Genouillac《特罗发掘》I（1934）。",
    "en": "At Telloh (Girsu), pre-Sargonic levels and finds are documented in de Genouillac Fouilles de Telloh I (1934)."
  },
  "civilization_ids": [
    "civ-mesopotamia"
  ],
  "site_ids": [
    "site-lagash-girsu"
  ],
  "period_ids": [
    "period-early-dynastic"
  ],
  "object_ids": [
    "asm-telloh-genouillac-presargonic"
  ],
  "sources": [
    "src-mesopotamia-genouillac-telloh-i-1934"
  ],
  "disclaimer": null,
  "editorial": {
    "derived_from": [
      "data/civilizations/civ-mesopotamia.md",
      "sources/src-*"
    ],
    "derived_on": "2026-10-12",
    "notes": "Paraphrased from cited registered sources only; density pass 3. | Substance tighten 2026-10-12: Tightened: pre-Sargonic levels first."
  }
}
