{
  "id": "claim-waf-niani-hyp-seed-n",
  "entity": "claim",
  "kind": "hypothesis",
  "statement": {
    "zh": "尼阿尼地望候选依赖文本与考古的不同对应。",
    "en": "Niani location candidates depend on differing text–archaeology mappings.",
    "native": null
  },
  "civilization_ids": [
    "civ-west-africa-medieval"
  ],
  "site_ids": [
    "site-waf-niani-seed-n"
  ],
  "period_ids": [
    "period-waf-mali-seed-n"
  ],
  "object_ids": [],
  "sources": [
    "src-waf-niani-seed-n",
    "src-waf-mali-seed-n"
  ],
  "disclaimer": "Capital identification remains contested.",
  "editorial": {
    "derived_from": [
      "tools/hot_densify/densify_seed_batch_n.py",
      "docs/coverage-map.md",
      "docs/decisions.md#d-2026-10-13-08"
    ],
    "derived_on": "2026-10-13",
    "notes": "Seed densify Batch N toward ~71 sources (D-2026-10-13-08). No invented pages/coords/finds/media. Status stays library-seed-rich."
  }
}
