{
  "id": "claim-waf-koumbi-seed-j",
  "entity": "claim",
  "kind": "fact",
  "statement": {
    "zh": "昆比萨利赫常被讨论为加纳帝国都城候选。",
    "en": "Koumbi Saleh is often discussed as a candidate Ghana empire capital.",
    "native": null
  },
  "civilization_ids": [
    "civ-west-africa-medieval"
  ],
  "site_ids": [
    "site-waf-koumbi-deepen-f"
  ],
  "period_ids": [],
  "object_ids": [],
  "sources": [
    "src-waf-koumbi-seed-j",
    "src-waf-levtzion-seed-j"
  ],
  "disclaimer": null,
  "editorial": {
    "derived_from": [
      "tools/hot_densify/densify_seed_batch_j.py",
      "docs/coverage-map.md",
      "docs/decisions.md#d-2026-10-13-04"
    ],
    "derived_on": "2026-10-13",
    "notes": "Seed densify Batch J toward ~48 sources (D-2026-10-13-04). No invented pages/coords/finds/media. Status stays library-seed-rich."
  }
}
