{
  "id": "claim-waf-unesco-116-seed-n",
  "entity": "claim",
  "kind": "fact",
  "statement": {
    "zh": "教科文名录116将杰内古城列为世界遗产。",
    "en": "UNESCO list 116 designates Old Towns of Djenné as World Heritage.",
    "native": null
  },
  "civilization_ids": [
    "civ-west-africa-medieval"
  ],
  "site_ids": [
    "site-waf-djenne-seed-n"
  ],
  "period_ids": [],
  "object_ids": [],
  "sources": [
    "src-waf-unesco-116-seed-n",
    "src-waf-djenne-seed-n"
  ],
  "disclaimer": null,
  "editorial": {
    "derived_from": [
      "tools/hot_densify/densify_seed_batch_n.py",
      "docs/coverage-map.md",
      "docs/decisions.md#d-2026-10-13-08"
    ],
    "derived_on": "2026-10-13",
    "notes": "Seed densify Batch N toward ~71 sources (D-2026-10-13-08). No invented pages/coords/finds/media. Status stays library-seed-rich."
  }
}
