{
  "id": "claim-ugarit-ibn-hani-seed-g",
  "entity": "claim",
  "kind": "fact",
  "statement": {
    "zh": "拉斯伊本哈尼提供王室驻地与沿海郊区证据。",
    "en": "Ras Ibn Hani supplies evidence of a royal residence and coastal suburb.",
    "native": null
  },
  "civilization_ids": [
    "civ-levant-ugarit"
  ],
  "site_ids": [
    "site-ugarit-ras-ibn-hani-seed-g"
  ],
  "period_ids": [],
  "object_ids": [],
  "sources": [
    "src-ugarit-ras-ibn-hani-seed-g",
    "src-ugarit-yon-seed-g"
  ],
  "disclaimer": null,
  "editorial": {
    "derived_from": [
      "tools/hot_densify/densify_seed_batch_g.py",
      "docs/coverage-map.md",
      "docs/decisions.md#d-2026-10-13-01"
    ],
    "derived_on": "2026-10-13",
    "notes": "Seed densify Batch G toward ~48 sources (D-2026-10-13-01). No invented pages/coords/finds/media. Status stays library-seed-rich."
  }
}
