{
  "id": "claim-olmec-empire-political",
  "entity": "claim",
  "kind": "hypothesis",
  "statement": {
    "zh": "奥尔梅克心腹地带构成统一帝国——政体类型学假说，非定论。",
    "en": "A unified Olmec “empire” across the heartland is a polity-typology hypothesis, not established fact."
  },
  "civilization_ids": [
    "civ-olmec"
  ],
  "site_ids": [
    "site-san-lorenzo",
    "site-la-venta",
    "site-tres-zapotes"
  ],
  "period_ids": [],
  "object_ids": [],
  "sources": [
    "src-olmec-pool-2007",
    "src-olmec-diehl-2004"
  ],
  "disclaimer": "This record is a HYPOTHESIS / contested scholarly reading, not an established archaeological conclusion. Do not treat as fact.",
  "editorial": {
    "derived_from": [
      "data/civilizations/civ-olmec.md",
      "sources/src-*"
    ],
    "derived_on": "2026-10-11",
    "notes": "Density pass D-2026-10-11-27; bibliographic details verified via WebSearch/catalogs; no invented page numbers/coordinates/forged images."
  }
}
