{
  "id": "claim-cahokia-chronology-seed-m",
  "entity": "claim",
  "kind": "fact",
  "statement": {
    "zh": "编年框架约束洛曼—斯特灵—穆尔黑德序列。",
    "en": "Chronology frameworks constrain the Lohmann–Stirling–Moorehead sequence.",
    "native": null
  },
  "civilization_ids": [
    "civ-cahokia"
  ],
  "site_ids": [
    "site-cahokia-chronology-seed-m"
  ],
  "period_ids": [],
  "object_ids": [],
  "sources": [
    "src-cahokia-chronology-seed-m",
    "src-cahokia-pauketat-seed-m"
  ],
  "disclaimer": null,
  "editorial": {
    "derived_from": [
      "tools/hot_densify/densify_seed_batch_m.py",
      "docs/coverage-map.md",
      "docs/decisions.md#d-2026-10-13-07"
    ],
    "derived_on": "2026-10-13",
    "notes": "Seed densify Batch M toward ~71 sources (D-2026-10-13-07). No invented pages/coords/finds/media. Status stays library-seed-rich."
  }
}
