{
  "id": "claim-jomon-sannai-large-settlement-habu",
  "entity": "claim",
  "kind": "fact",
  "statement": {
    "zh": "Habu 案例研究将三内丸山表述为复杂采集—渔猎社会中的大型绳文聚落，并讨论其兴衰（Habu 2008 Antiquity）。",
    "en": "Habu’s case study frames Sannai Maruyama as a large Jōmon settlement in a complex hunter-gatherer society and discusses growth and decline (Habu 2008 Antiquity)."
  },
  "civilization_ids": [
    "civ-jomon-yayoi"
  ],
  "site_ids": [
    "site-sannai-maruyama"
  ],
  "period_ids": [
    "period-jomon-early-middle"
  ],
  "object_ids": [],
  "sources": [
    "src-jomon-habu-sannai-antiquity-2008",
    "src-jomon-habu-ancient-jomon",
    "src-jomon-unesco-1632"
  ],
  "disclaimer": null,
  "editorial": {
    "derived_from": [
      "tools/wave1_shells/densify_wave1.py",
      "docs/coverage-map.md",
      "docs/decisions.md#d-2026-10-12-13"
    ],
    "derived_on": "2026-10-12",
    "notes": "Wave-1 densify to library-seed-rich (D-2026-10-12-13). No invented pages/coords/finds/media art. Honest thin > fake dense."
  }
}
