{
  "id": "claim-pueblo-depop-seed-n",
  "entity": "claim",
  "kind": "fact",
  "statement": {
    "zh": "十三世纪北圣胡安人口迁离机制仍有争论。",
    "en": "Mechanisms of thirteenth-century northern San Juan depopulation remain debated.",
    "native": null
  },
  "civilization_ids": [
    "civ-ancestral-pueblo"
  ],
  "site_ids": [
    "site-pueblo-depop-seed-n"
  ],
  "period_ids": [
    "period-pueblo-iv-seed-n"
  ],
  "object_ids": [],
  "sources": [
    "src-pueblo-depop-seed-n",
    "src-pueblo-seba-seed-n"
  ],
  "disclaimer": null,
  "editorial": {
    "derived_from": [
      "tools/hot_densify/densify_seed_batch_n.py",
      "docs/coverage-map.md",
      "docs/decisions.md#d-2026-10-13-08"
    ],
    "derived_on": "2026-10-13",
    "notes": "Seed densify Batch N toward ~71 sources (D-2026-10-13-08). No invented pages/coords/finds/media. Status stays library-seed-rich."
  }
}
