{
  "id": "claim-mitanni-alalakh-seed-l",
  "entity": "claim",
  "kind": "fact",
  "statement": {
    "zh": "阿拉拉赫是米坦尼影响下的附庸城邦案例。",
    "en": "Alalakh is a client-polity case under Mitanni influence.",
    "native": null
  },
  "civilization_ids": [
    "civ-mitanni"
  ],
  "site_ids": [
    "site-mitanni-alalakh-seed-l"
  ],
  "period_ids": [],
  "object_ids": [],
  "sources": [
    "src-mitanni-alalakh-seed-l",
    "src-mitanni-liverani-seed-l"
  ],
  "disclaimer": null,
  "editorial": {
    "derived_from": [
      "tools/hot_densify/densify_seed_batch_l.py",
      "docs/coverage-map.md",
      "docs/decisions.md#d-2026-10-13-06"
    ],
    "derived_on": "2026-10-13",
    "notes": "Seed densify Batch L toward ~71 sources (D-2026-10-13-06). No invented pages/coords/finds/media. Status stays library-seed-rich."
  }
}
